countries,Has the jursidiction adopted BEPS in the local regulations?,"Coverage in terms of Master File, Local File, and CbCR",Material differences from OECD report template,Sufficiency of BEPS format for penalty protection,mcaa_status,Contemporaneous Doc Requirement,TP Doc Thresholds,MF Threshold,LF Thresholds,CbCR Thresholds,Language Requirements,TP Forms,TP Disclosure with Tax Return,TP Forms and Disclosure Deadline,CIT Deadline,MF Deadline,CbCR Deadlines,CbCR Notification Deadlines,TP Doc Preparation Deadline,TP Doc Submit Deadline,Local vs Regional Comparables,Are New Searches Required Each Year?,Penalties,Penalty Relief
Albania," No; however, Albania joined the Inclusive Framework on BEPS in August 2019. ", This is not applicable. , This is not applicable. ," The local transfer pricing regulations are generally in line with the BEPS Action 13 format. However, in order to ensure that it is considered complete and to achieve penalty protection, it should also contain the local industry and market analyses; an overview of the local entity, including any local strategies; and the organizational structure of the local entity. ", No. ," Yes, it has. There are no explicit requirements to prepare the transfer pricing documentation contemporaneously. However, it is advisable to have it prepared by the corporate income tax (CIT) return date, i.e., 31 March of the following year. ", There is a revenue threshold of ALL50 million. , This is not applicable. , This is not applicable. , This is not applicable. ," Pursuant to Paragraph 15.6 of the Transfer Pricing Instruction, the transfer pricing documentation should be submitted in English or in Albanian. If it is in English, it should be accompanied by a notarized translation into Albanian, which should be provided within 30 days of the tax authorities request for translation. "," Taxpayers are required to report all controlled transactions annually by filing an annual controlled transaction notice if the aggregate value of their controlled transactions, including loan balances, exceeds ALL50 million (approximately EUR410,000). The annual controlled transaction notice should be submitted by 31 March of the following year. When determining the annual aggregate transaction value, taxpayers should take into account all intercompany transaction amounts (i.e., without offsetting credit and debit values). "," There are no other related-party disclosures or additional forms required by the legislation, except those included in the financial statements. ", The annual controlled transaction notice should be submitted by 31 March of the following year. , The CIT return should be submitted by 31 March of the following year. , This is not applicable. , This is not applicable. , This is not applicable. ," There is no specific deadline for the preparation of the transfer pricing documentation. However, since the documentation must be submitted within 30 days upon tax authorities request, it is recommended that it be prepared by the CIT return deadline, i.e., 31 March of the following year. "," There is no specific deadline for the submission of transfer pricing documentation. The transfer pricing documentation must be submitted within 30 days upon receipt of the tax authorities request, which can be initiated at any time after the filing due date of the income tax return (i.e., 31 March of the following year). "," Preference is given to local comparables. In the absence of local comparables, regional comparables can be used, but the differences between geographical markets and other factors affecting the financial indicator being analyzed must be taken into consideration in the comparable analysis. It is an EY jurisdiction practice to first attempt local comparables, and if not available, the search can be extended to regional comparables in the following order: Balkans, Eastern Europe and the EU. "," The transfer pricing rules do not include any general provision in this respect. It is an EY jurisdiction practice to perform a fresh benchmarking search every three to five years. The financial update is performed annually. The transfer pricing rules state that taxpayers with a turnover of less than ALL50 million that use external comparable data can use the same data for three consecutive fiscal years. This is applicable, provided that there have been no material changes in the conditions of the controlled transactions, the comparability of the external data and the relevant economic circumstances. "," > Consequences for incomplete documentation If the documentation is considered as incomplete, the taxpayer does not benefit from the penalty relief, in case of transfer pricing adjustments performed during a transfer pricing audit. > Consequences of failure to submit, late submission or incorrect disclosures The failure to file the annual controlled transaction notice (explained in the Transfer pricing return and related- party disclosures section above) is subject to a penalty of ALL10,000 for each month of delay. > If an adjustment is sustained, can penalties be assessed if documentation is deemed incomplete? Yes, transfer pricing adjustments for which no documentation has been made available or such documentation is considered as incomplete trigger a penalty of 0.06% of the amount of the unpaid liability for each day of delay, capped at 21.9% (an equivalent of 365 days). > If an adjustment is sustained, can penalties be assessed if documentation is deemed non-contemporaneous? There are no explicit requirements to prepare the transfer pricing documentation contemporaneously. > Is interest charged on penalties or payable on a refund? There is no interest charged on penalties. "," Taxpayers that have submitted the transfer pricing documentation in a timely manner (i.e., within 30 days upon receipt of the tax authorities request) and in compliance with the transfer pricing rules are relieved from penalties in the case of a transfer pricing adjustment. They will be liable to pay only the additional tax liability and default interest. The taxpayer has the option of appealing the decision of the tax authorities. Initially, the appeal is addressed to the Regional Tax Directorate, further to the Tax Appeal Directorate and, if applicable, to the administrative court after all administrative appeal methods have been exhausted. "
Algeria, , This is not applicable. ," The Algerian transfer pricing legislation only refers to a document to be structured as follows: > A base document relating to general information relating to the group > A document specific to the company subject to the documentation obligation Furthermore, following provisions of the Finance Act for FY2019, Algeria introduced a complementary documentation obligation. Entities subject to the obligation of submitting a transfer pricing document may be requested by the tax authorities, notably in the frame of an audit, to provide a complementary document that aims to provide specific information, which could be tax rulings and advance pricing agreements (APAs) obtained by the group in other jurisdictions. ", This is not applicable. , No. ," Yes, the minimum information requirements are set by the decree of 12 April 2012. They include information about (i) the group and (ii) the entity subject to the documentation obligation (including the financial information of the documented fiscal year). All entities (i) registered with the tax department responsible for large-sized companies (Direction des Grandes Entreprises DGE), in addition to (ii) groups of companies as well as (iii) foreign companies and (iv) companies set up in Algeria being members of foreign groups registered at the level of other tax offices must submit their transfer pricing documentation along with their annual tax returns (before 30 April of each year). ", There are no materiality limits or thresholds. , This is not applicable. , This is not applicable. , This is not applicable. ," The transfer pricing documentation needs to be submitted in the local language. The Algerian Constitution mandates the use of Arabic or French in official exchanges and documents filed with the administration. French is, in practice, the language used for all tax filings. ", There is no specific return to be filed in addition the transfer pricing documentation itself. ," In the framework of a tax audit, tax inspectors are entitled to audit the possible infringement of the arms-length principle with related parties (intercompany transactions), such as the existence of a commercial or financial relationship that differs from those that would be made between independent enterprises. Moreover, as per new provisions of the 2018 Finance Act, the tax administration is now allowed to ask for the group consolidated accounts (locally or abroad). Furthermore, according to provisions of the 2019 Finance Act, entities subject to the obligation of submitting transfer pricing documentation may be required, in the context of a tax audit, to provide complementary documentation if the primary file submitted is considered to be insufficient by the tax inspectors. Complementary documentation may notably include tax rulings and APAs obtained by the group in other jurisdictions. ", This is not applicable. , 30 April of the next fiscal year (Y+1). , This is not applicable. , This is not applicable. , This is not applicable. , 30 April of the subsequent year to current year under consideration. ," The statutory deadline for the submission of transfer pricing documentation is the same as that of the corporate income tax return, which is 30 April of the subsequent year to current year under consideration. This is now required for all firms performing transactions locally and internationally with related companies (see above section 4a companies which are subject to the documentation obligation). "," Local comparables are preferred, although regional comparables could in some cases be accepted because of a lack of local data. "," There are no specific guidelines or requirements under the current legislation on the need to conduct a fresh benchmarking search every year or for updating the financials of a prior study. However, the Algerian legislations trend to follow the OECD Guidelines recommendations to update the benchmark study every three years. "," > Consequences for incomplete documentation In case of incomplete documentation, the tax authorities can ask for a complementary documentation or information or decide to trigger an audit to assess any irregularities. The documentation can also be considered as non-receivable (not valid) for not respecting the format provided by the local legislation, in such case, the penalty for failure to submit could apply (see below). In case of incomplete transfer pricing documentation, tax authorities may: > Ask for complementary transfer pricing documentation and information > Initiate a tax audit > Apply the same penalty than for failure to submit (see below), if they consider the transfer pricing documentation insufficient to ensure transfer pricing protection > Consequences of failure to submit, late submission or incorrect disclosures For companies with a filing obligation, the Algerian transfer pricing legislation provides that the penalty for failure to submit the transfer pricing documentation is DZD2 million. For taxpayers subject to a tax audit, the tax administration is entitled to send a formal notice asking for the transfer pricing documentation or the complementary transfer pricing documentation to be provided within 30 days. In case of failure, the DZD2 million penalty is applied. > If an adjustment is sustained, can penalties be assessed, if documentation is deemed incomplete? Yes, the reassessed tax base will provide for a corporate income tax adjustment amount in addition to a base penalty of 25%. In addition, the reassessed amount will also be subject to tax on deemed transferred profits. > If an adjustment is sustained, can penalties be assessed if documentation is deemed non-contemporaneous? No. In practice, penalties being imposed for non- contemporaneous documentation have not been observed. > Is interest charged on penalties or payable on a refund? Interest (late-payment penalties) can be charged on principal and base penalties if the latter are not paid on schedule. These interests are capped at 25%, on the total reassessed amount (amounts deemed to be transferred indirectly). "," No specific penalty relief is applicable to transfer pricing, but general penalty relief could apply in the framework of a transaction procedure (remise conditionnelle) provided by the Algerian Tax Procedure Code, under certain conditions. A relief can also be granted for late payment penalties under the graceful remittance (remise gracieuse) procedure, under certain conditions. "
Angola, No. , > This is not applicable. ," > Angola has not adopted the Master File and Local File approach, and full local transfer pricing documentation is expected from each eligible taxpayer. "," Angola has not adopted the Master File and Local File approach, and full local transfer pricing documentation is expected from each eligible taxpayer. Consequently, only transfer pricing documentation fully compliant with local regulations can be considered to protect against potential penalties. ", No. ," Yes, the transfer pricing documentation must be prepared and submitted to the tax authorities by the end of the sixth month after the fiscal years closing date. It also needs to be contemporaneous. "," The documentation applies to all companies reporting annual revenue of more than AOA7 billion, including those listed on the large taxpayers list: large government-owned companies, financial banking institutions, insurance and reinsurance companies, pension fund management companies and pension funds, payment system operators and providers, microcredit companies, oil and gas companies, diamond companies, telecommunications companies, and companies operating in a monopoly regime. ", This is not applicable. , This is not applicable. , This is not applicable. , The transfer pricing documentation needs to be submitted in the local language (Portuguese). , This is not applicable. ," No additional related-party detailed information is disclosed to the General Tax Administration, other than the submission of entity-specific transfer pricing documentation, when applicable. "," 2 Group A encompasses public entities, companies with a share capital equal or higher than AOA2 million, and companies with annual total revenues equal to or greater than AOA500 million. Also included in Group A are associations, foundations or cooperatives whose activities generate additional revenues other than the subsidies received. Affilia- tions of international companies whose headquarters are not located in Angola also belong to Group A. Group B comprises all the taxpayers not included in Group A. This is not applicable. ", 31 May for Group A and 30 April for Group B.2 , This is not applicable. , This is not applicable. , This is not applicable. ," Transfer pricing documentation must be prepared within six months after the fiscal year-end, until 30 June. "," Transfer pricing documentation must be prepared and submitted to the tax administration within six months of the fiscal year-end, until 30 June. "," There is very limited, if any, comparable financial data available on public databases regarding Angolan companies. "," Yes, although not specified in the legislation, doing a fresh benchmarking study is followed as a market practice. "," > Consequences for incomplete documentation See below. > Consequences of failure to submit, late submission or incorrect disclosures The General Tax Administration notifies large taxpayers who failed to file transfer pricing documentation to pay a tax fine under the General Tax Code (namely, No. 2 of Article 198). The fine amount can range from AOA10,000 to AOA50,000. Existing notifications indicate that the maximum amount of the range is being applied. The application of penalties in this regard will imply a reputational risk to the taxpayer, as it will be considered noncompliant. Moreover, non-compliance with transfer pricing documentation requirements may result in such taxpayers being forbidden from performing capital operations, current invisible transactions (payments for services and intangibles), or trading operations that, according to the current exchange control regulations, require an intervention from the National Bank of Angola. In practice, it may block the day-to-day activity of any taxpayer if its legal name is communicated by the General Tax Administration to the National Bank of Angola, specifying non- compliance with tax obligations > If an adjustment is sustained, can penalties be assessed if documentation is deemed incomplete? If a transfer pricing adjustment is made, a penalty equivalent to 25% of the additional tax will be applied, plus late interest at the non-compounded rate of 1% per month (or 12% per year). > If an adjustment is sustained, can penalties be assessed if documentation is deemed non-contemporaneous? If a transfer pricing adjustment is made, a penalty equivalent to 25% of the additional tax will be applied, plus late interest at the non-compounded rate of 1% per month (or 12% per year). > Is interest charged on penalties or payable on a refund? This is not applicable. ", This is not applicable. 
