Lithuania, Lithuania has adopted or implemented BEPS Action 13 for TP documentation in the local regulations. ," All three, i.e., Master File, Local File and CbCR, are covered. "," There are material differences between the OECD report template and Lithuanias regulations. Master File: It is a description of the supply chain for the groups five largest products and service offerings by turnover plus any other products and services amounting to more than 5% of group turnover. The required description could take the form of a chart or a diagram. Local File: Additionally, in the Local File, companies have to provide TP documentation preparation and update dates. ", There are no provisions related to penalty protection with respect to compliance with the BEPS Action 13 format report. ," Yes, it is so as of 25 October 2016. "," Yes, TP rules are in place. TP documentation must be submitted upon request. There is no contemporaneous requirement; however, annually, TP documentation should be updated regarding actual applied pricing in the respective year. "," There is a materiality limit for TP documentation: > If sales revenues of a certain company exceeded EUR3 million in a previous year, then the company has to prepare a TP documentation Local File. > If the sales revenue of a company that belongs to an international group exceeded EUR15 million in a previous year, then the company has to prepare a TP documentation Master File. However, regardless of sales revenues, the following companies have to prepare TP documentation Local File: > Financial companies and credit institutions, the activities of which are regulated by the Law on Financial Institutions of the Republic of Lithuania. > Insurance companies, the activities of which are regulated by the Law on Insurance of the Republic of Lithuania. But it is not necessary to prepare a Local File when controlled transactions are carried out between Lithuanian taxpayers and are related activities carried out in Lithuania. > Companies with foreign units operating in Lithuania through a permanent establishment where sales revenue exceeded EUR3 million in a previous year. ", A company has to prepare a Master File for the following year if its turnover exceeded EUR15 million. , A company has to prepare a Local File for the following year if its turnover exceeded EUR3 million. , CbCR is mandatory for the following companies if: > The company belongs to an international group of companies > Consolidated income of such a group of companies exceeds EUR750 million ," If the TP documentation is prepared in English language version, the Lithuanian tax authorities may request that translation be provided. "," The rules for completing Form FR0528, Report on Transactions or Economic operations Between Associated Parties, are set forth in the Order of the Head of the State Tax Inspectorate No. VA-27 as of 22 March 2005. Form FR0528 must be submitted within six months at the end of each tax period. No other specific TP returns shall be provided to the Lithuanian tax authorities. "," An associated-party disclosure annex (Form FR0528) to the annual CIT return has to be submitted when the taxpayers associated-party transactions exceed an annual value of approximately EUR90,000. On Form FR0528, taxpayers are required to provide information about the transactions between associated parties related to fixed tangible and intangible assets, stocks and goods, financial and other services, securities and derivatives, and rent of property and loans. The taxpayers are also required to inform the tax authorities whether any TP method prescribed in the TP rules has been used in the transactions disclosed. ", Other FR0528 forms (transaction with associated entities) must be submitted within 6 months and 15 days after the end of each tax period. , CIT return must be submitted within six months and fifteen days after the end of each tax period. ," This applies for fiscal years beginning on or after 1 January 2019. It must be prepared within six months and 15 days after the end of each tax period if not advised otherwise. If the tax authorities require it, the Master File would need to be submitted in 30 days. ", The CbCR must be submitted within 12 months from the end of the reporting fiscal year of the MNE group. , CbCR notification should be submitted by the end of the reporting financial year of the MNE group. ," Based on new legislation for transactions carried out on 1 January 2019, the following deadlines to prepare the documentation apply: > TP documentation should be prepared within six months and 15 days after the end of each tax period. However, taxpayers have to submit the TP documentation within 30 days from the corresponding notice by the tax authorities in an audit or an inquiry. ", There is no statutory deadline for the submission of TP documentation. ," Local requirements follow the OECD Guidelines. There is a preference for domestic comparables over foreign comparables (if no local comparables are found, foreign may be used). ", The benchmarking results have to be updated once every three years. Financial updates are performed annually. ," > Consequences for incomplete documentation Non-compliance with TP documentation regulations exposes a taxpayer to a penalty that may vary from EUR1,820 up to EUR5,590. If the company fails to comply with the TP documentation regulations repeatedly, the penalty increases and may vary from EUR3,770 to EUR6,000. > Consequences of failure to submit, late submission or incorrect disclosures Non-compliance with TP documentation regulations exposes a taxpayer to a penalty that may vary from EUR1,820 up to EUR5,590. If the company fails to comply with the TP documentation regulations repeatedly, a penalty increases and may vary from EUR3,770 to EUR6,000. > If an adjustment is sustained, can penalties be assessed if documentation is deemed incomplete? General tax penalties of 10% to 50% of the additional tax apply in the case of taxable income adjustments. > If an adjustment is sustained, can penalties be assessed if documentation is deemed non-contemporaneous? General tax penalties of 10% to 50% of the additional tax apply in the case of taxable income adjustments. > Is interest charged on penalties or payable on a refund? This is not applicable. ", TP penalties are subject to general penalty relief rules. The penalties can be reduced by up to 10% of the outstanding CIT if the taxpayer properly communicates with the tax authorities and presents all requested documents and explanations. 
Luxembourg, Luxembourg has adopted BEPS Action 13 for transfer pricing documentation in the local regulations only in terms of CbCR. ," CbCR is covered. The Law of 23 December 2016 states that if the ultimate parent entity (UPE) of an MNE group that is required to prepare consolidated financial statements, or that would be required to do so if equity interests in any of its enterprises were listed, with a consolidated annual group turnover of at least EUR750 million is a Luxembourg tax resident, the entity must submit a CbCR to the Luxembourg tax authorities. Alternatively, a Luxembourg group entity that is not the UPE of the MNE group (the surrogate parent entity) should file a CbCR with the Luxembourg tax authorities in one of the following cases: > The UPE is not obligated to file a CbCR in its jurisdiction of residence. > The UPE is obligated to submit a CbCR, but there is no automatic exchange of CbC reports between Luxembourg and the jurisdiction of residence of the UPE. > The UPE is obligated to submit a CbCR, and there is an automatic exchange of CbC reports, but because of systematic failure, no effective exchange of information takes place. A Luxembourg group entity will need to notify the Luxembourg tax authorities by the end of the financial year as to whether it is the UPE or surrogate parent entity. If it is not, it will have to inform the Luxembourg tax authorities of the identity of the UPE or surrogate parent entity (including the identification of its tax residency). The CbCR should be filed annually, within 12 months of the last day of the financial year. ", This is not applicable. ," Since Luxembourg legislation does not include specific documentation requirements, BEPS Action 13 format would be acceptable for local purposes. "," Yes, it was signed on 27 January 2016. "," Luxembourgian tax law includes general documentation requirements but does not provide specific transfer pricing documentation regulations. The General Tax Law has been amended to extend the existing general obligation of taxpayers so they can justify the data contained in their tax returns with appropriate information and documentation (codified in Section 171 of the General Tax Law) for transfer pricing matters. This provision is reinforced by a third paragraph clarifying that the general documentation requirements set forth by this provision also apply to transactions between associated enterprises. In the absence of further guidance, one could rely on the 2017 edition of the OECD Transfer Pricing Guidelines and the Practical Manual on Transfer Pricing for Developing Countries issued by the United Nations to get additional information on what types of documentation a taxpayer may be required to provide. Reference is also made to the European Councils Code of Conduct on transfer pricing documentation for associated enterprises in the EU, dated 2006, aimed at harmonizing the transfer pricing documentation that multinationals have to provide to tax authorities. As a general rule, contemporaneous documentation should exist when transactions are carried out. The Luxembourg tax authorities may request such documentation upon review of the tax return. ", There is no materiality limit. , This is not applicable. , This is not applicable. , The threshold is set at EUR750 million (consolidated annual group turnover). , The transfer pricing documentation need not be submitted in the local language (English is acceptable). ," Currently, there are no transfer pricing-specific returns to be filed separately or with the corporate income tax return. "," It is a common practice that transactions with related parties are detailed by nature and by related party in a schedule attached to the tax returns. Moreover, a taxpayer is requested to disclose in the tax return, inter alia, whether it has engaged into any transactions with related parties during the year and whether it has opted for the simplification measure provided in the Circular LIR No 56/1 56bis/1 on intragroup financing. ", This is not applicable. ," No specific submission requirement, but the transfer pricing documentation should be available upon tax return submission, i.e., 31 May. ", This is not applicable. , The deadline is 12 months after the last day of the reporting fiscal year of the MNE group. , The deadline is by the end of the reporting fiscal year. ," There is no statutory deadline for the preparation of transfer pricing documentation, but transfer pricing documentation should be available to support the information in the tax return. As a general rule, contemporaneous documentation should exist when transactions are carried out. "," Luxembourgs tax law does not include a deadline to produce transfer pricing documentation. However, taxpayers must be able to justify the data contained in their tax returns with appropriate information and transfer pricing documentation. ", OECD guidance should be followed. , OECD guidance should be followed. ," > Consequences for incomplete documentation As a general rule (not specific but also applicable to transfer pricing matters), any tax return that is intentionally incomplete or has inexact information, or any non-declaration, can result in a fine. Furthermore, administrative penalties may be applied to enforce a taxpayers delivery of general documentation within the assessment. Finally, to the extent that the arms-length standard is not respected, the tax authority may reassess or adjust the taxable result. > Consequences of failure to submit, late submission or incorrect disclosures See above. > If an adjustment is sustained, can penalties be assessed if documentation is deemed incomplete? A tax return that is intentionally incomplete or has inexact information, or any non-declaration, can result in a fine not exceeding 25% of the taxes avoided or unduly reimbursed but not less than 5% of the taxes avoided or unduly reimbursed. With regard to the CbCR rules, in the cases of failure on filing, late filing, inclusion of incomplete or inexact information, or in the case of not respecting any of the obligations included in the mentioned draft law, a penalty of up to EUR250,000 can be imposed on the declaring entity. This penalty is imposed at the discretion of the competent tax authority. The declaring entity can appeal the decision to the Administrative Court. > If an adjustment is sustained, can penalties be assessed if documentation is deemed non-contemporaneous? Not specified. > Is interest charged on penalties and payable on a refund? There is none specified. "," An appeal before the Director of Direct Tax Administration can be lodged against penalties within three months. The adjustment will be materialized within the tax assessment. Again, an appeal can be filed against this tax assessment (see below). "
Madagascar," Partially; as Madagascar is not member of OECD, the local regulations have neither adopted nor implemented all of BEPS Action 13. It has not implemented country-by-country reporting but only implemented the Master File and Local File requirement. ", TP documentation requirements in Madagascar only include Master File about the multinational group as a whole and Local File concerning the local entity and its controlled transactions. CbCR is not yet referred to the TP documentation requirements. ," The local TP documentation (Master File and Local File) report format has not been issued yet. However, based on the minimum content of Master File and Local File listed in the Note No. 012-2021/MEF/SG/DGI/DLFC/SFI, the minimum content of the local TP documentation is quite similar to the OECD content. The local regulations include in its list of information required for Local File an additional specific bullet point related to (i) the obligation to list transactions with associates and (ii) to insert in Local File information on transactions with companies located in privileged tax regime states. "," The TP documentation (MF and LF) should comply with the local regulations format template that will be issued by the DGI (which we assume will be based on OECD Template as Note No. 012-2021/MEF/SG/DGI/DLFC/SFI refers to OECD guidelines on mandatory information required). However, the DGI has the right to assess its content, and there is still a risk of penalty in the case where some mandatory information is missing or not provided on time upon request of tax authorities in case of tax audit. ", No. ," Yes, Madagascar has its TP documentation guidelines. TP documentation should be prepared at the time of the transaction or at the time of reporting and submitted online at the same time as the tax returns. ", There are no limits or thresholds for intragroup transactions to be supported by TP documentation. , No. , No. , This is not applicable. ," TP documentation reporting must be completed in a French version. However, in case of a tax audit, if the taxpayer submits TP documentation in another language, a certified translation of the documents along with the original documents must be submitted at the request of the tax authority within the time limit indicated in the request. "," TP regulations provide that there is a format to be respected. However, this format is not yet available from the tax authority. The TP documentation is reported online or in physical version. "," The transaction and the information about the entities are detailed in those files. Identification of associated enterprises should be included in the Master File and the Local File. The texts do not provide appendices, so it is variable depending on the transaction and the situation of the company. "," Except for this first year of implementation for FY 2020, the timeline to report was extend to 31 March 2022 instead of the normal date of CIT return. In case of tax audit, the timeline to provide TP documentation or additional information is one month with the possibility to apply for the extension of this to two months. In case the responses provided are not sufficient, the DGI can grant 30 additional days. "," TP documentation is reported as a separate return but at the same time as the corporate income tax return as follows: Companies using the standard tax year must file financial statements and the corporate income tax return by 15 May of the year following the tax year. For companies choosing a tax year-end other than the standard tax year-end, the filing must be made by the 15th day of the fourth month following the year-end. For companies whose fiscal year ends on a date other than that defined in the above, must file financial statement and corporate income tax return no later than the 15th day of May of the following year. ", TP documentation should be prepared at the time of the transaction or at the time of reporting and submitted online at the same time as the tax returns. , This is not applicable. , This is not applicable. , TP documentation should be prepared at the time of the transaction or at the time of reporting and submitted online at the same time as the tax returns. , TP documentation is reported at the same time as the corporate income tax return. Please refer to 6.a) for CIT returns. ," Malagasy TP law and practice are still recent, and the tax authorities have not yet required or recommended specific benchmarking methods. "," Malagasy TP law and practice are still recent, and the tax authorities have not yet required or recommended specific practical guidelines. "," > Consequences of failure to submit, late submission or incorrect disclosures Penalty of MGA10 million (approximately USD2,500) if a company does not provide any documentation or provides insufficient information by the aforementioned deadlines (at the same time as CIT return or the first month of request, within the granted extension or by the 30-day additional- information period for additional documentation requested by the Tax authorities during a tax audit ) In case of tax audit, an automatic adjustment would be added to this penalty. > If an adjustment is sustained, can penalties be assessed if documentation is deemed incomplete? Yes, in the case of an adjustment, the tax authorities would reclaim the benefits that should have been achieved if the transaction was made at arms length and apply penalties of: > 40% as standard penalties > 80% in the case of fraudulent tactics > 150% in the case of resistance during the tax audit > If an adjustment is sustained, can penalties be assessed if documentation is deemed non-contemporaneous? The same as the above. > Is interest charged on penalties or payable on a refund? This is not applicable. "," There is no specific penalty relief applicable to TP. The General Tax Code provides for the following dispute resolution options: > Transaction with the tax authorities > Referral to the Tax Appeal Committee, which offers its expertise, although its opinions do not bind the tax authorities > The administrative litigation procedure with the tax authorities > Referral to courts "
Malawi," No, Malawi has not adopted BEPS Action 13 for transfer pricing documentation in local regulations. "," The Master File is not applicable in Malawi. However, the coverage for Local File is the same as the coverage under OECD Guidelines, and the scope is provided under Taxation (Transfer Pricing Documentation) Regulations 2017. ", There is no material difference with OECD report template. , This is not yet adopted or applicable. , No. ," Yes we do have the Transfer Pricing Documentation Guidelines in place. However, taxpayers are not required to prepare the contemporaneous Transfer Pricing Documentation, but, they are not required to submit unless the Commissioner General of Malawi Revenue Authority requests for submission. "," The limit applies to domestic transactions with a value of more than USD135,000. ", This is not applicable. , This is not applicable. , This is not applicable. , All transfer pricing documents should be maintained in English. , This is not applicable. ," Effective from 1 July 2017, all related-party transactions need to be tested to show that they are at arms length. Maintaining a transfer pricing document is a requirement. ", There is none specified. , The documentation should be filed within 180 days after the end of the financial year. , This is not applicable. , This is not applicable. , This is not applicable. ," Documentation deadlines are not stipulated, but the Commissioner General may require a taxpayer to provide the necessary documentation within a period of 45 days of written request from the Commissioner General. ", There is no statutory deadline for submission of transfer pricing documentation. ," Local comparables are preferred, but comparables from different geographic markets with similar economic circumstances with the tested party could be accepted if information on uncontrolled transactions is not available locally (Transfer Pricing Regulation 9). "," The regulations indicate that the taxpayer should have documentation in place that verifies that the conditions in related-party transactions for the year of assessment (YA) are consistent with the arms-length principle. The regulation does not explicitly suggest a fresh benchmarking search every year, but because of the multiple-year analysis, a fresh benchmarking is preferred. "," > Consequences of failure to submit, late submission or incorrect disclosures Penalty for failure to submit transfer pricing documentation as demanded by the Commissioner General of the MRA is USD1,400 plus a further penalty of USD2,100 for each additional month the documents remain un-submitted. If the taxpayer fails to comply after initial penalty and subsequent penalties, the taxpayer shall be liable to additional penalties in an unlimited amount as determined by the Commissioner General. > If an adjustment is sustained, can penalties be assessed if documentation is deemed incomplete? As for adjustments to income tax payable, including tax adjustments relating to transfer pricing, normally, 100% of the taxes is involved.If an adjustment is sustained, can penalties be assessed if documentation is deemed non-contemporaneous? As for adjustments to income tax payable, including tax adjustments relating to transfer pricing, normally, 100% of the taxes is involved.Is interest charged on penalties or payable on a refund? Interest is due on overdue taxes, including additional taxes assessed in terms of transfer pricing at the prevailing bank- lending rate plus 5%. ", Penalty relief is available at the Commissioner Generals discretion. The taxpayer may appeal to the Commissioner General of the MRA and then to the special arbitrator. The final appeal can be made to the High Court. 
